{
  "schemaVersion": "1.0.0",
  "project": {
    "projectId": "mercy-clause",
    "title": "The Mercy Clause",
    "language": "en",
    "packageVersion": "0.1.0",
    "runtimeTarget": "hodor-interactive",
    "hodorProjectId": 1785137013680,
    "climaxSceneId": "SCENE-004",
    "endingSceneId": "SCENE-005"
  },
  "world": {
    "premise": "During a hospital merger, an emergency physician discovers that an automated charity-care policy is quietly excluding the patients it was designed to protect.",
    "rules": [
      "Every emergency admission receives a machine-generated eligibility score.",
      "The merger vote can be paused only by an on-record patient-safety finding.",
      "A physician who accesses sealed billing data risks immediate suspension."
    ],
    "settings": [
      {
        "locationId": "LOC-TRIAGE",
        "name": "Night triage unit",
        "dramaticUse": "Pressure without privacy"
      },
      {
        "locationId": "LOC-DATA-LAB",
        "name": "Clinical data lab",
        "dramaticUse": "Evidence changes relationship leverage"
      },
      {
        "locationId": "LOC-MERGER-HEARING",
        "name": "Public merger hearing",
        "dramaticUse": "Institutional ritual becomes confrontation"
      }
    ]
  },
  "characters": [
    {
      "characterId": "CHAR-ROWAN",
      "displayName": "Rowan Hale",
      "role": "protagonist and emergency physician",
      "want": "Keep her department open through the merger.",
      "need": "Define patient safety without waiting for institutional permission.",
      "fear": "Being dismissed as emotionally compromised.",
      "flaw": "She treats private competence as sufficient proof.",
      "voice": "Economical, observant, and exact under pressure.",
      "arc": "She moves from protecting her professional standing to making the institution answer publicly.",
      "oocBoundaries": ["She does not fabricate patient evidence."]
    },
    {
      "characterId": "CHAR-JULIAN",
      "displayName": "Julian Cross",
      "role": "merger architect and former partner",
      "want": "Complete the merger without reopening the charity-care model.",
      "need": "Accept that private reassurance cannot substitute for accountable policy.",
      "fear": "Losing the system he believes only he can stabilize.",
      "flaw": "He converts affection into a demand for discretion.",
      "voice": "Warm, controlled, and strategically incomplete.",
      "arc": "His claim to benevolent control collapses when the consequences become public.",
      "oocBoundaries": ["He does not confess without documentary pressure."]
    },
    {
      "characterId": "CHAR-AMINA",
      "displayName": "Amina Shaw",
      "role": "resident and skeptical witness",
      "want": "Protect patients without ending her career.",
      "need": "Turn observation into accountable testimony.",
      "fear": "Retaliation that will follow her through training.",
      "flaw": "She waits for senior people to name the risk first.",
      "voice": "Fast, clinical, and increasingly direct.",
      "arc": "She moves from anonymous concern to signed testimony.",
      "oocBoundaries": ["She does not expose patient identities."]
    },
    {
      "characterId": "CHAR-LEON",
      "displayName": "Leon Mercer",
      "role": "board counsel and procedural gatekeeper",
      "want": "Close the vote without creating discoverable liability.",
      "need": "Recognize that procedure can preserve harm.",
      "fear": "An uncontrolled public record.",
      "flaw": "He equates legal defensibility with safety.",
      "voice": "Formal, narrow, and visibly unsettled by facts.",
      "arc": "He becomes the procedural witness who cannot erase the record.",
      "oocBoundaries": ["He does not offer medical conclusions."]
    }
  ],
  "relationships": [
    {
      "relationshipId": "REL-ROWAN-JULIAN",
      "fromCharacterId": "CHAR-ROWAN",
      "toCharacterId": "CHAR-JULIAN",
      "pressure": "Old intimacy gives Julian access to Rowan's need for professional legitimacy.",
      "visibleChange": "Rowan refuses a private departmental guarantee and addresses him through the hearing record."
    },
    {
      "relationshipId": "REL-ROWAN-AMINA",
      "fromCharacterId": "CHAR-ROWAN",
      "toCharacterId": "CHAR-AMINA",
      "pressure": "Amina needs protection while Rowan needs evidence only Amina observed.",
      "visibleChange": "They replace unspoken loyalty with explicit shared responsibility."
    },
    {
      "relationshipId": "REL-ROWAN-LEON",
      "fromCharacterId": "CHAR-ROWAN",
      "toCharacterId": "CHAR-LEON",
      "pressure": "Leon controls procedure while Rowan controls the clinical interpretation.",
      "visibleChange": "Leon is forced to enter her safety finding into the permanent record."
    }
  ],
  "causalChain": [
    {
      "linkId": "CAUSE-001",
      "causeSceneId": "SCENE-001",
      "effectSceneId": "SCENE-002",
      "rationale": "A rejected patient creates a discrepancy that can be tested against the eligibility model."
    },
    {
      "linkId": "CAUSE-002",
      "causeSceneId": "SCENE-002",
      "effectSceneId": "SCENE-003",
      "rationale": "The model discrepancy gives Julian enough exposure to offer Rowan a private departmental guarantee."
    },
    {
      "linkId": "CAUSE-003",
      "causeSceneId": "SCENE-003",
      "effectSceneId": "SCENE-004",
      "rationale": "Rowan's refusal and Amina's signed testimony create the legal basis to interrupt the hearing."
    },
    {
      "linkId": "CAUSE-004",
      "causeSceneId": "SCENE-004",
      "effectSceneId": "SCENE-005",
      "rationale": "The public safety finding pauses the merger and transfers policy review to a patient-led panel."
    }
  ],
  "scenes": [
    {
      "sceneId": "SCENE-001",
      "title": "The Rejected Admission",
      "locationId": "LOC-TRIAGE",
      "summary": "Rowan treats a deteriorating patient whose charity-care admission has been rejected by the new scoring model.",
      "emotionalFunctionId": "REWARD-AGENCY",
      "beats": [
        {
          "beatId": "BEAT-001",
          "kind": "action",
          "text": "Rowan overrides the discharge timer long enough to stabilize the patient."
        },
        {
          "beatId": "BEAT-002",
          "kind": "dialogue",
          "speakerId": "CHAR-AMINA",
          "text": "The score changed after I entered her interpreter request."
        },
        {
          "beatId": "BEAT-003",
          "kind": "dialogue",
          "speakerId": "CHAR-ROWAN",
          "text": "Save the screen. Do not copy the patient's name."
        }
      ]
    },
    {
      "sceneId": "SCENE-002",
      "title": "The Hidden Variable",
      "locationId": "LOC-DATA-LAB",
      "summary": "Rowan and Amina prove that accessibility requests are acting as a hidden penalty in the eligibility score.",
      "emotionalFunctionId": "MECH-EVIDENCE-LADDER",
      "beats": [
        {
          "beatId": "BEAT-004",
          "kind": "action",
          "text": "Amina reproduces the score with synthetic patient records."
        },
        {
          "beatId": "BEAT-005",
          "kind": "dialogue",
          "speakerId": "CHAR-ROWAN",
          "text": "The model is charging people for the help they need to understand us."
        },
        {
          "beatId": "BEAT-006",
          "kind": "action",
          "text": "Julian sees the test log through the glass wall and locks the billing dataset."
        }
      ]
    },
    {
      "sceneId": "SCENE-003",
      "title": "A Private Guarantee",
      "locationId": "LOC-DATA-LAB",
      "summary": "Julian promises to preserve Rowan's department if she waits until after the merger to challenge the model.",
      "emotionalFunctionId": "REWARD-BETRAYAL",
      "beats": [
        {
          "beatId": "BEAT-007",
          "kind": "dialogue",
          "speakerId": "CHAR-JULIAN",
          "text": "Give me one week, and your unit survives with your name on the door."
        },
        {
          "beatId": "BEAT-008",
          "kind": "dialogue",
          "speakerId": "CHAR-ROWAN",
          "text": "You kept my department as the price of my silence."
        },
        {
          "beatId": "BEAT-009",
          "kind": "action",
          "text": "Rowan declines the guarantee while Amina signs the test log as a witness."
        }
      ]
    },
    {
      "sceneId": "SCENE-004",
      "title": "The Safety Finding",
      "locationId": "LOC-MERGER-HEARING",
      "summary": "Rowan interrupts the merger vote with a reproducible test and demands an on-record patient-safety finding.",
      "emotionalFunctionId": "MECH-PUBLIC-REVERSAL",
      "beats": [
        {
          "beatId": "BEAT-010",
          "kind": "action",
          "text": "Leon attempts to classify the result as a billing dispute."
        },
        {
          "beatId": "BEAT-011",
          "kind": "dialogue",
          "speakerId": "CHAR-ROWAN",
          "text": "Call it billing after you explain why asking for an interpreter changes a medical door from open to closed."
        },
        {
          "beatId": "BEAT-012",
          "kind": "action",
          "text": "Amina repeats the test live, and Leon enters the safety finding into the record."
        }
      ]
    },
    {
      "sceneId": "SCENE-005",
      "title": "Terms of Care",
      "locationId": "LOC-TRIAGE",
      "summary": "With the merger paused, Rowan gives up sole control of her department to build a patient-led review panel.",
      "emotionalFunctionId": "REWARD-RECOGNITION",
      "beats": [
        {
          "beatId": "BEAT-013",
          "kind": "action",
          "text": "The rejected patient returns for follow-up through a temporary human review process."
        },
        {
          "beatId": "BEAT-014",
          "kind": "dialogue",
          "speakerId": "CHAR-AMINA",
          "text": "They offered you the chair."
        },